{
  "version": 1,
  "title": "PBOC debit — PSE select, GPO, records, DDA, ARQC/TC",
  "scheme": "EMV",
  "steps": [
    {
      "capdu": "00A404000E315041592E5359532E444446303100",
      "rapdu": "6F1E840E315041592E5359532E4444463031A50C8801015F2D027A689F1101019000"
    },
    {
      "capdu": "00B2010C00",
      "rapdu": "702861264F08A000000333010101500A50424F432044454249549F120A50424F432044454249548701019000"
    },
    {
      "capdu": "00B2020C00",
      "rapdu": "6A83"
    },
    {
      "capdu": "00A4040008A00000033301010100",
      "rapdu": "6F4D8408A000000333010101A541500A50424F432044454249548701019F380C9F7A019F02065F2A02DF69015F2D027A689F1101019F120A50424F43204445424954BF0C0A9F4D020B0ADF4D020C0A9000"
    },
    {
      "capdu": "80A800000C830A0000000000000101560000",
      "rapdu": "80127C00080102001001030118010200200101009000"
    },
    {
      "capdu": "00B2010C00",
      "rapdu": "701457126212142300000000065D29032204939031129000"
    },
    {
      "capdu": "00B2020C00",
      "rapdu": "70055F200220209000"
    },
    {
      "capdu": "00B2011400",
      "rapdu": "70465F24032903315A0A6212142300000000065F5F3401009F0702FF008E0C000000000000000042031F009F0D05D0601CA8009F0E0500108000009F0F05D0681CF8005F280201569000"
    },
    {
      "capdu": "00B2021400",
      "rapdu": "7081B89F4681B00683F840B4F244B2DBDD05B862A8601C6B010134B393C2CB82A16E7DC36F06EFE4D07EFF549780625F3364F02C170A9930C0E0745FDD96558D6430418577C0EDB70A03229E351FF34864C3C1804717FE33E3D13D09C21878C2D2CAEBEF9175BE0604B4497C59EBFB00F2526E66576D1576FBEF84155189752C74C4D6628CAC56EA559D2D73ADB1A9A0DB78A321BA51713E7A02F23C6AE1048D76B4A2105F6FE65FFCD7CDE9D3FD705AB378772C09E12F9F4701039000"
    },
    {
      "capdu": "00B2031400",
      "rapdu": "7081BD9381B0BB95890A98FDE7CD620109C88575BB3182743496270EF444C1C88127D44EC519FFAD151B464FE28213F91F6541793ABDC803632C0E4C7239949261BA3920CCA7683B794D320612A42CCE0695C28C257BE727E6E9F5A471247F9939B3782752A06F03A5305F1E4F7E4AB6992A744B3DA74AAFA68DABFD2B07FCD2C2A0274728E5992F16F50FC6C25099548518C5DBCAF8692516F8A0262EB8BDCFC2F24A38A53F3143AA37892CF1EFBB91FA8156C082E35F25031501019F4A01829000"
    },
    {
      "capdu": "00B2011C00",
      "rapdu": "7081FB9081F800CA2AD8A6A37457BE78C57BFB18E7ADA7245937C0AA09B0CD6B7977F27644E2131363C939387F64C3598C20AA8B3656478181BEE38D458AB430E8DC4653094D592B6A69B63F5FF446E74CCAB47104E4042AC63A28FDB3B7DD522E5E222FFEA995B955F413080AA2FE56263E5ECC2F7715BB978AE1081A56AE8491BA179BD37AFB4723DE96518BCD4D18A1696D6821960560EDCDC758DE964B6D294B2CDD898DC3C8B138E0658AEBD4C19A4C3D5E39E0AF4541767946BDDE5D15D204EC012437D8D066747F29E1A0D0D7917020D3DA5A93F714A4340777857C1B3E876B278092AA0109FC806706B6BE649ECBB1EAAD858799F64039CB24739000"
    },
    {
      "capdu": "00B2021C00",
      "rapdu": "70535F300202208C1B9F02069F03069F1A0295055F2A029A039C019F37049F21039F4E148D1D8A029F02069F03069F1A0295055F2A029A039C019F37049F21039F4E149F080200309F49039F37048F010B9F3201039000"
    },
    {
      "capdu": "00B2012400",
      "rapdu": "70089F1401009F2301009000"
    },
    {
      "capdu": "0088000004F46CF05A00",
      "rapdu": "808180693D426C0B498B1CED342973773B8C8E55783A081169B49FD5C4BEC186BBCE477E05825E0BFA8CA464442E08750A642029A4E62500679C69A4CAC815071A22EC4C43AC16B848CD389BEF7A6334C10BB6BC00A7F4B20A01EEC73CC81E74A558E4034B22F0C675801B90A8CCE4B4AAA8F7D54D7701ABF9E1AB85A71AA0BB1EE1029000"
    },
    {
      "capdu": "80AE80003400000000000100000000000001560000048000015626101500F46CF05A091837000000000000000000000000000000000000000000",
      "rapdu": "801E80026F860E1779BB9F7F8B07010103A0B806010A010000000000F2ACD9849000"
    },
    {
      "capdu": "00820000080102030405060708",
      "rapdu": "6700"
    },
    {
      "capdu": "80AE400036303000000000000100000000000001560000048040015626101500F46CF05A091837000000000000000000000000000000000000000000",
      "rapdu": "801E40026F7B95002A00492DB80701010360BC06010A010000000000F2ACD9849000"
    }
  ]
}
